{"artifact_id":"account-strategy-current-epoch-crosswalk","as_of_date":"2026-09-04","calculation_cutoff_date":"2026-09-02","disposition_counts":{"EXCLUDED_DEPRECATED_HISTORY_ONLY":1,"EXCLUDED_IMMATERIAL":1,"INCLUDED_PRODUCT_EPOCH":13},"rows":[{"account_id":"account-1b44c987969b9e47","account_label":"IBKR \u20226907","assignment_id":"assignment-c4a0afd74ffbbb7110f8","effective_end":null,"effective_start":"2026-01-22","last_four":"6907","owner_reason":"CURRENT_PRODUCT_EPOCH","product_epoch_disposition":"INCLUDED_PRODUCT_EPOCH","provider":"IBKR","strategy_id":"p123-ai-factor"},{"account_id":"account-98f5986706ed53c5","account_label":"Schwab \u20227703 \u2014 Roth (Jess)","assignment_id":"assignment-1a7207cf061af6c34d87","effective_end":null,"effective_start":"2026-01-05","last_four":"7703","owner_reason":"CURRENT_PRODUCT_EPOCH","product_epoch_disposition":"INCLUDED_PRODUCT_EPOCH","provider":"SCHWAB","strategy_id":"qsi"},{"account_id":"account-a13937e26b8ae46d","account_label":"Schwab \u20223293 \u2014 IRA (Jess)","assignment_id":"assignment-20f9c99859c4834b5557","effective_end":null,"effective_start":"2025-12-29","last_four":"3293","owner_reason":"CURRENT_PRODUCT_EPOCH","product_epoch_disposition":"INCLUDED_PRODUCT_EPOCH","provider":"SCHWAB","strategy_id":"tt-portfolio"},{"account_id":"account-c63d2a487e019790","account_label":"Schwab \u20225620 \u2014 PCRA Trust","assignment_id":"assignment-290bbcb919e3bceb0124","effective_end":null,"effective_start":"2025-11-25","last_four":"5620","owner_reason":"CURRENT_PRODUCT_EPOCH","product_epoch_disposition":"INCLUDED_PRODUCT_EPOCH","provider":"SCHWAB","strategy_id":"tt-portfolio"},{"account_id":"account-9cb2832ca2366f08","account_label":"Composer \u2014 Holy Grail","assignment_id":"assignment-2f74964b2e625ce548ea","effective_end":null,"effective_start":"2025-09-22","last_four":null,"owner_reason":"COMPOSER_OWNER_EXCLUDED_IMMATERIAL","product_epoch_disposition":"EXCLUDED_IMMATERIAL","provider":"COMPOSER","strategy_id":"composer-holy-grail"},{"account_id":"account-38b653b91ff43a10","account_label":"Schwab \u20225722 \u2014 IRA (Boris)","assignment_id":"assignment-3249397d8b8ad6465825","effective_end":null,"effective_start":"2026-01-05","last_four":"5722","owner_reason":"CURRENT_PRODUCT_EPOCH","product_epoch_disposition":"INCLUDED_PRODUCT_EPOCH","provider":"SCHWAB","strategy_id":"qsi"},{"account_id":"account-98f5986706ed53c5","account_label":"Schwab \u20227703 \u2014 Roth (Jess)","assignment_id":"assignment-3264f53d431137854811","effective_end":"2026-01-04","effective_start":"2025-11-25","last_four":"7703","owner_reason":"CURRENT_PRODUCT_EPOCH","product_epoch_disposition":"INCLUDED_PRODUCT_EPOCH","provider":"SCHWAB","strategy_id":"tt-portfolio"},{"account_id":"account-702c489650e59956","account_label":"Schwab \u20224054 \u2014 Joint Tenant","assignment_id":"assignment-435c2b993598ca75cf9c","effective_end":null,"effective_start":"2025-11-25","last_four":"4054","owner_reason":"CURRENT_PRODUCT_EPOCH","product_epoch_disposition":"INCLUDED_PRODUCT_EPOCH","provider":"SCHWAB","strategy_id":"tt-portfolio"},{"account_id":"account-38b653b91ff43a10","account_label":"Schwab \u20225722 \u2014 IRA (Boris)","assignment_id":"assignment-601489f2e42e2b5e93de","effective_end":"2026-01-04","effective_start":"2025-11-25","last_four":"5722","owner_reason":"CURRENT_PRODUCT_EPOCH","product_epoch_disposition":"INCLUDED_PRODUCT_EPOCH","provider":"SCHWAB","strategy_id":"tt-portfolio"},{"account_id":"account-d69701da9143c430","account_label":"IBKR \u20229054","assignment_id":"assignment-3ccd5fe5f862ee998cc1","effective_end":null,"effective_start":"2025-11-20","last_four":"9054","owner_reason":"CURRENT_PRODUCT_EPOCH","product_epoch_disposition":"INCLUDED_PRODUCT_EPOCH","provider":"IBKR","strategy_id":"p123-eu"},{"account_id":"account-61092059d066f056","account_label":"Schwab \u20222824 \u2014 Joint Tenant","assignment_id":"assignment-faa77692d5b792f4384f","effective_end":null,"effective_start":"2026-01-02","last_four":"2824","owner_reason":"CURRENT_PRODUCT_EPOCH","product_epoch_disposition":"INCLUDED_PRODUCT_EPOCH","provider":"SCHWAB","strategy_id":"grizzlybears-vtma"},{"account_id":"account-d2e5821e608e25f1","account_label":"Matrixport \u2014 Robuxio Crypto","assignment_id":"assignment-d66a19410c8016e150dd","effective_end":null,"effective_start":"2025-12-06","last_four":null,"owner_reason":"CURRENT_PRODUCT_EPOCH","product_epoch_disposition":"INCLUDED_PRODUCT_EPOCH","provider":"MATRIXPORT","strategy_id":"robuxio-crypto"},{"account_id":"account-cff10c44aedcf5e8","account_label":"Schwab \u20226757 \u2014 Roth (Boris)","assignment_id":"assignment-cace867c4e66d3b9c989","effective_end":null,"effective_start":"2025-11-25","last_four":"6757","owner_reason":"CURRENT_PRODUCT_EPOCH","product_epoch_disposition":"INCLUDED_PRODUCT_EPOCH","provider":"SCHWAB","strategy_id":"tt-portfolio"},{"account_id":"account-58e75e8d952fa1b8","account_label":"Quantbase \u2014 Volatis Strategy","assignment_id":"assignment-7a2b80307ce3b4057fa1","effective_end":null,"effective_start":"2024-10-15","last_four":null,"owner_reason":"CURRENT_PRODUCT_EPOCH","product_epoch_disposition":"INCLUDED_PRODUCT_EPOCH","provider":"QUANTBASE","strategy_id":"volatis-strategy"},{"account_id":"account-0acb9e17da731d0e","account_label":"Alpaca \u20226903","assignment_id":"assignment-e9c757e811c3a67b6f84","effective_end":"2025-11-24","effective_start":"2025-09-27","last_four":"6903","owner_reason":"ECHOTRADE_DEPRECATED_EFFECTIVE_2025_11_25","product_epoch_disposition":"EXCLUDED_DEPRECATED_HISTORY_ONLY","provider":"ALPACA","strategy_id":"echotrade-growth-pivots"}],"schema_version":1,"selected_baseline":{"artifact_id":"normalized/portfolio-baseline.json","as_of_date":"2026-09-04","generation_id":"1c4441ea26c8164f7f0993917cf34cce64bb7260e70f92c2a7024029ce899d0d","schema_name":"portfolio-baseline-catalog","schema_version":"1","sha256":"f2d6260966985d95ce5fae13365febdef27b93f79dc96da85077eafb60abe413","size_bytes":10254875}}
